{
  "id": "circle-of-stars",
  "name": "Circle of Stars",
  "class": "druid",
  "label": "Druid Circle",
  "source": { "book": "TCE", "page": 37 },
  "summary": "An astronomer-druid who takes on constellation forms for archery, healing, or spell power.",
  "flavor": "The Circle of Stars allows druids to draw on the power of starlight. These druids have tracked heavenly patterns since time immemorial, discovering secrets hidden amid the constellations and recording them in star charts of their own making.",
  "playstyle": "A versatile ranged druid that doesn't need Wild Shape to contribute. The Archer form gives you a free bonus-action attack, the Chalice heals, and the Dragon form guarantees you never lose concentration.",
  "features": [
    {
      "name": "Star Map",
      "level": 2,
      "description": "You create a star chart as a spellcasting focus. You know the *guidance* cantrip, and you always have *guiding bolt* prepared — you can cast it without a spell slot a number of times equal to your proficiency bonus per long rest. If the map is lost, you can perform a 1-hour ceremony to replace it."
    },
    {
      "name": "Starry Form",
      "level": 2,
      "description": "As a bonus action, you can expend a use of Wild Shape to take on a luminous starry form rather than transforming into a beast. It lasts 10 minutes and sheds bright light in a 10-foot radius. Choose a constellation each time:\n\n**Archer.** As a bonus action, make a ranged spell attack against a creature within 60 feet, dealing 1d8 + your Wisdom modifier radiant damage.\n\n**Chalice.** Whenever you cast a spell that restores hit points, you or another creature within 30 feet regains 1d8 + your Wisdom modifier hit points.\n\n**Dragon.** When you make an Intelligence or Wisdom check or a Constitution saving throw to maintain concentration, you can treat a roll of 9 or lower on the d20 as a 10."
    },
    {
      "name": "Cosmic Omen",
      "level": 6,
      "description": "After a long rest, you can consult your Star Map and roll a die to determine an omen — Weal (even) or Woe (odd). Whenever a creature you can see within 30 feet makes an attack roll, saving throw, or ability check, you can use your reaction to roll a d6 and either add it (Weal) or subtract it (Woe). You can use this a number of times equal to your proficiency bonus per long rest."
    },
    {
      "name": "Twinkling Constellations",
      "level": 10,
      "description": "Your Starry Form improves: the Archer and Chalice dice become 2d8, and while in Dragon form you gain a flying speed of 20 feet and can hover. Additionally, at the start of each of your turns while in a Starry Form, you can change which constellation you are using."
    },
    {
      "name": "Full of Stars",
      "level": 14,
      "description": "While in your Starry Form, you become partially incorporeal, giving you resistance to bludgeoning, piercing, and slashing damage."
    }
  ]
}
