{
  "id": "arcana-domain",
  "name": "Arcana Domain",
  "class": "cleric",
  "label": "Divine Domain",
  "source": { "book": "SCAG", "page": 125 },
  "summary": "A cleric who studies the Weave itself, learning wizard cantrips and true resurrection.",
  "flavor": "Gods of magic are often served by elves, gnomes, and other folk with an innate arcane gift. Their clerics are seekers of arcane knowledge who see divine and arcane magic as two expressions of the same underlying truth.",
  "playstyle": "A hybrid caster with access to wizard cantrips and two wizard spells added to your always-prepared list. Arcane Mastery at 17th level grants some of the strongest spells in the game.",
  "expandedSpells": {
    "1st": ["detect magic", "magic missile"],
    "3rd": ["magic weapon", "Nystul's magic aura"],
    "5th": ["dispel magic", "magic circle"],
    "7th": ["arcane eye", "Leomund's secret chest"],
    "9th": ["planar binding", "teleportation circle"]
  },
  "features": [
    {
      "name": "Arcane Initiate",
      "level": 1,
      "description": "You gain proficiency in the Arcana skill, and you learn two cantrips of your choice from the wizard spell list. They count as cleric cantrips for you but don't count against your cantrips known."
    },
    {
      "name": "Channel Divinity: Arcane Abjuration",
      "level": 2,
      "description": "As an action, you present your holy symbol and one celestial, elemental, fey, or fiend within 30 feet that can see or hear you must make a Wisdom saving throw. On a failure it is turned for 1 minute or until it takes damage. A turned creature must move away from you and can't willingly move within 30 feet of you. At higher levels the feature can banish a turned creature of a sufficiently low challenge rating back to its home plane: CR 1/2 at 5th level, CR 1 at 8th, CR 2 at 11th, CR 3 at 14th, and CR 4 at 17th."
    },
    {
      "name": "Spell Breaker",
      "level": 6,
      "description": "When you restore hit points to an ally with a spell of 1st level or higher, you can also end one spell of your choice on that creature. The level of the spell you end must be equal to or lower than the level of the slot you used to heal."
    },
    {
      "name": "Potent Spellcasting",
      "level": 8,
      "description": "You add your Wisdom modifier to the damage you deal with any cleric cantrip."
    },
    {
      "name": "Arcane Mastery",
      "level": 17,
      "description": "You choose four spells from the wizard spell list — one each of 6th, 7th, 8th, and 9th level. You add them to your list of domain spells, so they are always prepared and don't count against the number of spells you can prepare."
    }
  ]
}
