{
  "id": "champion",
  "name": "Champion",
  "class": "fighter",
  "label": "Martial Archetype",
  "source": { "book": "PHB", "page": 72 },
  "summary": "Raw, simple physical excellence — crits on 19-20, then 18-20, plus a second fighting style.",
  "flavor": "The archetypal Champion focuses on the development of raw physical power honed to deadly perfection. Those who model themselves on this archetype combine rigorous training with physical excellence to deal devastating blows.",
  "playstyle": "The simplest subclass in the game and an excellent choice for new players or as a multiclass dip. Low decision load in combat; Survivor makes you extremely hard to kill at high levels.",
  "features": [
    {
      "name": "Improved Critical",
      "level": 3,
      "description": "Your weapon attacks score a critical hit on a roll of 19 or 20."
    },
    {
      "name": "Remarkable Athlete",
      "level": 7,
      "description": "You can add half your proficiency bonus (rounded up) to any Strength, Dexterity, or Constitution check you make that doesn't already use your proficiency bonus. In addition, when you make a running long jump, the distance you can cover increases by a number of feet equal to your Strength modifier."
    },
    {
      "name": "Additional Fighting Style",
      "level": 10,
      "description": "You can choose a second option from the Fighting Style class feature."
    },
    {
      "name": "Superior Critical",
      "level": 15,
      "description": "Your weapon attacks score a critical hit on a roll of 18-20."
    },
    {
      "name": "Survivor",
      "level": 18,
      "description": "At the start of each of your turns, you regain hit points equal to 5 + your Constitution modifier if you have no more than half your hit points left. You don't gain this benefit if you have 0 hit points."
    }
  ]
}
