{
  "id": "the-celestial",
  "name": "The Celestial",
  "class": "warlock",
  "label": "Otherworldly Patron",
  "source": { "book": "XGE", "page": 54 },
  "summary": "An empyrean patron makes you the rare warlock who heals — radiant light and healing dice.",
  "flavor": "Your patron is a powerful being of the Upper Planes — a couatl, an empyrean, a solar. You have bound yourself to this being, and your soul is a beacon of light against the darkness. Your pact allows you to serve as a conduit for divine power.",
  "playstyle": "The support warlock. Healing Light is a substantial pool of bonus-action healing that refreshes on a long rest, and you get cleric-style radiant spells while keeping short-rest Pact Magic.",
  "expandedSpells": {
    "1st": ["cure wounds", "guiding bolt"],
    "2nd": ["flaming sphere", "lesser restoration"],
    "3rd": ["daylight", "revivify"],
    "4th": ["guardian of faith", "wall of fire"],
    "5th": ["flame strike", "greater restoration"]
  },
  "features": [
    {
      "name": "Bonus Cantrips",
      "level": 1,
      "description": "You learn the *light* and *sacred flame* cantrips. They count as warlock cantrips for you but don't count against your number of cantrips known."
    },
    {
      "name": "Healing Light",
      "level": 1,
      "description": "You gain the ability to channel celestial energy to heal wounds. You have a pool of d6s equal to 1 + your warlock level.\n\nAs a bonus action, you can heal one creature you can see within 60 feet, spending dice from the pool. The maximum number of dice you can spend at once equals your Charisma modifier (minimum one). You regain all expended dice when you finish a long rest."
    },
    {
      "name": "Radiant Soul",
      "level": 6,
      "description": "Your link to your patron allows you to serve as a conduit for radiant energy. You have resistance to radiant damage, and when you cast a spell that deals radiant or fire damage, you add your Charisma modifier to one radiant or fire damage roll of that spell."
    },
    {
      "name": "Celestial Resilience",
      "level": 10,
      "description": "You gain temporary hit points whenever you finish a short or long rest, equal to your warlock level + your Charisma modifier. Additionally, choose up to five creatures you can see at the end of the rest; they each gain temporary hit points equal to half your warlock level + your Charisma modifier."
    },
    {
      "name": "Searing Vengeance",
      "level": 14,
      "description": "The radiant energy you channel allows you to resist death. When you have to make a death saving throw at the start of your turn, you can instead spring back to your feet with a burst of radiant energy. You regain hit points equal to half your hit point maximum and then stand up if you so choose.\n\nEach creature of your choice within 30 feet must make a Constitution saving throw or take 2d8 + your Charisma modifier radiant damage and be blinded until the end of the current turn. Once used, you can't use this again until you finish a long rest."
    }
  ]
}
