{
  "id": "path-of-the-battlerager",
  "name": "Path of the Battlerager",
  "class": "barbarian",
  "label": "Primal Path",
  "source": { "book": "SCAG", "page": 121 },
  "summary": "Dwarven spiked-armor specialist who weaponizes their own body and armor.",
  "flavor": "Battleragers are dwarves who wear spiked armor and hurl themselves into combat, delighting in the chaos of the melee. Most are devoted to the dwarven gods of war and take a grim joy in grappling their foes and impaling them on their own plates.",
  "playstyle": "Very narrow — restricted to dwarves by the book's flavor and dependent on spiked armor. Damage output is low compared to other paths, but it is thematic and fun in grapple-heavy builds.",
  "features": [
    {
      "name": "Restriction: Dwarves Only",
      "level": 3,
      "description": "As written in the *Sword Coast Adventurer's Guide*, only dwarves may take this path. Many tables waive this restriction."
    },
    {
      "name": "Battlerager Armor",
      "level": 3,
      "description": "You gain the ability to use spiked armor (a form of medium armor) as a weapon. While wearing spiked armor and raging, you can use a bonus action to make one melee weapon attack with your armor spikes, dealing 1d4 piercing damage plus your Strength modifier. Additionally, when you use the Attack action to grapple a creature, you deal 3 piercing damage to it if the grapple succeeds."
    },
    {
      "name": "Reckless Abandon",
      "level": 6,
      "description": "When you use Reckless Attack while raging, you also gain temporary hit points equal to your Constitution modifier (minimum 1). They vanish when your rage ends."
    },
    {
      "name": "Battlerager Charge",
      "level": 10,
      "description": "You can take the Dash action as a bonus action while raging."
    },
    {
      "name": "Spiked Retribution",
      "level": 14,
      "description": "When a creature within 5 feet of you hits you with a melee attack, the attacker takes 3 piercing damage if you are raging, not incapacitated, and wearing spiked armor."
    }
  ]
}
