{
  "id": "hunter",
  "name": "Hunter",
  "class": "ranger",
  "label": "Ranger Archetype",
  "source": { "book": "PHB", "page": 93 },
  "summary": "A monster-killing specialist who picks combat techniques for hordes, giants, or single foes.",
  "flavor": "Emulating the Hunter archetype means accepting your place as a bulwark between civilization and the terrors of the wilderness. As you walk the hunter's path, you learn specialized techniques for fighting the threats you face, from rampaging ogres and hordes of orcs to towering giants and terrifying dragons.",
  "playstyle": "Flexible and reliable. Each tier lets you pick a technique suited to your campaign — Colossus Slayer is the standard single-target damage pick, and Horde Breaker is best against groups.",
  "features": [
    {
      "name": "Hunter's Prey",
      "level": 3,
      "description": "Choose one of the following options.\n\n**Colossus Slayer.** Your tenacity can wear down the most potent foes. When you hit a creature with a weapon attack, it takes an extra 1d8 damage if it's below its hit point maximum. You can deal this once per turn.\n\n**Giant Killer.** When a Large or larger creature within 5 feet hits or misses you with an attack, you can use your reaction to attack that creature immediately after its attack.\n\n**Horde Breaker.** Once on each of your turns when you make a weapon attack, you can make another attack with the same weapon against a different creature within 5 feet of the original target and within your weapon's range."
    },
    {
      "name": "Defensive Tactics",
      "level": 7,
      "description": "Choose one of the following options.\n\n**Escape the Horde.** Opportunity attacks against you are made with disadvantage.\n\n**Multiattack Defense.** When a creature hits you with an attack, you gain +4 AC against all subsequent attacks made by that creature for the rest of the turn.\n\n**Steel Will.** You have advantage on saving throws against being frightened."
    },
    {
      "name": "Multiattack",
      "level": 11,
      "description": "Choose one of the following options.\n\n**Volley.** You can use your action to make a ranged attack against any number of creatures within 10 feet of a point you can see within your weapon's range. You must have ammunition for each target and make a separate attack roll for each.\n\n**Whirlwind Attack.** You can use your action to make a melee attack against any number of creatures within 5 feet of you, with a separate attack roll for each target."
    },
    {
      "name": "Superior Hunter's Defense",
      "level": 15,
      "description": "Choose one of the following options.\n\n**Evasion.** When subjected to an effect allowing a Dexterity save for half damage, you take no damage on a success and half on a failure.\n\n**Stand Against the Tide.** When a hostile creature misses you with a melee attack, you can use your reaction to force that creature to repeat the same attack against another creature of your choice.\n\n**Uncanny Dodge.** When an attacker you can see hits you with an attack, you can use your reaction to halve the attack's damage against you."
    }
  ]
}
