{
  "id": "echo-knight",
  "name": "Echo Knight",
  "class": "fighter",
  "label": "Martial Archetype",
  "source": { "book": "EGW", "page": 183, "setting": "Explorer's Guide to Wildemount" },
  "summary": "A dunamancy warrior who fights alongside an echo of themselves pulled from another timeline.",
  "flavor": "Echo Knights emerged from the Kryn Dynasty of Xhorhas, warriors who wield the power of dunamis — the magic of possibility and gravity. They summon translucent echoes of alternate unrealized timelines of themselves, and fight in perfect concert with these shadows.",
  "playstyle": "Exceptional action economy and mobility. Your echo extends your reach anywhere on the battlefield, lets you attack from two places at once, and can be swapped with as a free teleport.",
  "features": [
    {
      "name": "Manifest Echo",
      "level": 3,
      "description": "As a bonus action, you manifest a magical, translucent echo of yourself in an unoccupied space within 15 feet. It has AC 14 + your proficiency bonus, 1 hit point, and immunity to all conditions. It lasts until destroyed, until you dismiss it, until you manifest another, or until you're incapacitated.\n\nWhile it persists you gain these benefits:\n- As a bonus action, you can swap places with the echo, teleporting up to 30 feet.\n- When you take the Attack action, any attack can originate from your space or the echo's.\n- When a creature that you can see within 5 feet of the echo provokes an opportunity attack, you can use your reaction to attack it as though you were in the echo's space.\n- As a bonus action, you can move the echo up to 30 feet, though it must stay within 30 feet of you."
    },
    {
      "name": "Unleash Incarnation",
      "level": 3,
      "description": "You can heighten your echo's fury. Whenever you take the Attack action, you can make one additional melee attack from the echo's position. You can use this a number of times equal to your Constitution modifier (minimum once) per long rest."
    },
    {
      "name": "Echo Avatar",
      "level": 7,
      "description": "As an action, you can see through your echo's eyes and hear through its ears. During this time, you are deafened and blinded, and the echo can be up to 1,000 feet away from you without being destroyed. The effect lasts up to 10 minutes or until you end it."
    },
    {
      "name": "Shadow Martyr",
      "level": 10,
      "description": "As a reaction when a creature you can see attacks a target other than you, you can make your echo intercept the attack — provided the echo is within 5 feet of the target. The echo is targeted by the attack instead, and it is destroyed. Once used, you can't use this again until you finish a short or long rest."
    },
    {
      "name": "Reclaim Potential",
      "level": 15,
      "description": "When your echo is destroyed by taking damage, you can gain temporary hit points equal to 2d6 + your Constitution modifier, provided you don't already have temporary hit points. You can use this a number of times equal to your Constitution modifier (minimum once) per long rest."
    },
    {
      "name": "Legion of One",
      "level": 18,
      "description": "You can use a bonus action to create two echoes with your Manifest Echo feature, and these echoes can coexist. If you try to create a third, the previous two vanish. Anything you can do from one echo's position can be done from the other's.\n\nAdditionally, when you roll initiative and have no uses of Unleash Incarnation remaining, you regain one use."
    }
  ]
}
