{
  "id": "battle-smith",
  "name": "Battle Smith",
  "class": "artificer",
  "label": "Artificer Specialist",
  "source": { "book": "TCE", "page": 15 },
  "summary": "A combat medic and defender who fights beside a Steel Defender and attacks with Intelligence.",
  "flavor": "Armies require protection, and someone has to put things back together if defenses fail. A combination of protector and medic, a Battle Smith is a warrior who fights alongside a steel defender — a construct of the artificer's own devising, loyal to the last.",
  "playstyle": "The strongest and most popular artificer. Battle Ready lets you attack with Intelligence, so you need only one good stat, and the Steel Defender is a durable companion with its own reaction-based ally protection.",
  "expandedSpells": {
    "3rd": ["heroism", "shield"],
    "5th": ["branding smite", "warding bond"],
    "9th": ["aura of vitality", "conjure barrage"],
    "13th": ["aura of purity", "fire shield"],
    "17th": ["banishing smite", "mass cure wounds"]
  },
  "features": [
    {
      "name": "Tool Proficiency",
      "level": 3,
      "description": "You gain proficiency with smith's tools. If you already have it, you gain proficiency with one other type of artisan's tools of your choice."
    },
    {
      "name": "Battle Ready",
      "level": 3,
      "description": "Your combat training and your experiments with magic have paid off in two ways:\n\n- You gain proficiency with martial weapons.\n- When you attack with a magic weapon, you can use your **Intelligence modifier**, instead of Strength or Dexterity, for the attack and damage rolls.\n\nSince your own infusions make weapons magical, this effectively makes Intelligence your only combat stat."
    },
    {
      "name": "Steel Defender",
      "level": 3,
      "description": "Your tinkering has borne fruit: you've created a steel defender, a construct that fights alongside you. It is friendly to you and your companions and obeys your commands.\n\nIts statistics scale with your artificer level and proficiency bonus. In combat it rolls its own initiative and acts on its own turn. It can take any action of its choice, not just Dodge, but its **Force-Empowered Rend** attack requires your bonus-action command.\n\nIts **Deflect Attack** reaction imposes disadvantage on an attack against another creature within 5 feet of it, dealing force damage if the attack misses. If it drops to 0 hit points, you can revive it with 1 hour of work and smith's tools."
    },
    {
      "name": "Extra Attack",
      "level": 5,
      "description": "You can attack twice, rather than once, whenever you take the Attack action on your turn."
    },
    {
      "name": "Arcane Jolt",
      "level": 9,
      "description": "You've learned new ways to channel arcane energy to harm or heal. When either you hit a target with a magic weapon attack or your steel defender hits a target, you can channel magical energy through the strike to create one of the following effects:\n\n- The target takes an extra 2d6 force damage.\n- Choose one creature or object you can see within 30 feet; it regains 2d6 hit points.\n\nYou can use this a number of times equal to your Intelligence modifier (minimum once) per long rest."
    },
    {
      "name": "Improved Defender",
      "level": 15,
      "description": "Your Arcane Jolt and steel defender become more powerful:\n\n- The extra damage and healing of your Arcane Jolt both increase to 4d6.\n- Your steel defender gains a +2 bonus to Armor Class.\n- Whenever your steel defender uses its Deflect Attack, the attacker takes force damage equal to 1d4 + your Intelligence modifier."
    }
  ]
}
