{
  "id": "war-magic",
  "name": "War Magic",
  "class": "wizard",
  "label": "Arcane Tradition",
  "source": { "book": "XGE", "page": 59 },
  "summary": "A battle mage who balances abjuration and evocation, warding themselves while blasting foes.",
  "flavor": "A variety of arcane colleges specialize in training wizards for war. The tradition of War Magic blends principles of evocation and abjuration, rather than specializing in either. It teaches techniques that empower a caster's spells while providing methods for wizards to bolster their own defenses.",
  "playstyle": "The survivability wizard. Arcane Deflection is a huge reaction bonus to AC or saves, Tactical Wit adds Intelligence to initiative, and Durable Magic keeps your concentration spells running.",
  "features": [
    {
      "name": "Arcane Deflection",
      "level": 2,
      "description": "You have learned to weave your magic to fortify yourself against harm. When you are hit by an attack or fail a saving throw, you can use your reaction to gain a +2 bonus to your AC against that attack, or a +4 bonus to that saving throw.\n\nWhen you use this feature, you can't cast spells other than cantrips until the end of your next turn."
    },
    {
      "name": "Tactical Wit",
      "level": 2,
      "description": "Your keen ability to assess tactical situations allows you to act quickly in battle. You gain a bonus to your initiative rolls equal to your Intelligence modifier."
    },
    {
      "name": "Power Surge",
      "level": 6,
      "description": "You can store magical energy within yourself to later empower your damaging spells. You can store a maximum number of power surges equal to your Intelligence modifier (minimum one).\n\nWhenever you successfully end a spell with *dispel magic* or *counterspell*, you gain one power surge. You also gain one whenever you finish a long rest, if you have none.\n\nWhen you deal damage with a wizard spell of 1st level or higher, you can spend one power surge to increase that damage by half your wizard level (rounded up)."
    },
    {
      "name": "Durable Magic",
      "level": 10,
      "description": "The magic you channel helps ward off harm. While you maintain concentration on a spell, you have a +2 bonus to AC and to all saving throws."
    },
    {
      "name": "Deflecting Shroud",
      "level": 14,
      "description": "Your Arcane Deflection becomes infused with deadly magic. When you use your Arcane Deflection feature, you can cause magical energy to arc from you. Up to three creatures of your choice that you can see within 60 feet each take force damage equal to half your wizard level."
    }
  ]
}
